<?xml version="1.0"?>
<!DOCTYPE press PUBLIC "-//FreeBSD//DTD FreeBSD XML Database for Press//EN"
                      "http://www.FreeBSD.org/XML/www/share/sgml/press.dtd">
<!--
 COMMITTERS PLEASE NOTE:
    News articles referenced in this file are also to be archived under
    "freefall:/c/www/bsddoc/press/".
-->
<press>
  <cvs:keywords xmlns:cvs="http://www.FreeBSD.org/XML/CVS" version="1.0">
    <cvs:keyword name="freebsd">
      $FreeBSD: www/share/sgml/press.xml,v 1.73 2009/01/14 04:25:43 jkoshy Exp $
    </cvs:keyword>
  </cvs:keywords>

  <year>
    <name>2009</name>

    <month>
      <name>1</name>
      <story>
	<name>Coyote Point Builds on FreeBSD to Accelerate</name>
	<url>http://www.internetnews.com/infra/article.php/3795791</url>
	<site-name>Internet News</site-name>
	<site-url>http://www.internetnews.com/</site-url>
	<date>13 January 2009</date>
	<author>Sean Michael Kerner</author>
	<p>FreeBSD is at the core of Coyote Point's appliance.</p>
      </story>

      <story>
	<name>FreeBSD 7.1 Gets a Little Help from Sun</name>
	<url>http://www.internetnews.com/dev-news/article.php/3794561</url>
	<site-name>Internet News</site-name>
	<site-url>http://www.internetnews.com/</site-url>
	<date>06 January 2009</date>
	<author>Sean Michael Kerner</author>
	<p>An article covering technology sharing between Sun and the FreeBSD
	  project and other new features in FreeBSD 7.1.</p>
      </story>
    </month>
  </year>

</press>
