<?xml version="1.0"?>
<!DOCTYPE press PUBLIC "-//FreeBSD//DTD FreeBSD XML Database for Press//EN"
                      "http://www.FreeBSD.org/XML/www/share/sgml/press.dtd">
<!--
 COMMITTERS PLEASE NOTE:
    News articles referenced in this file are also to be archived under
    "freefall:/c/www/bsddoc/press/".
    $FreeBSDde: de-www/share/sgml/press.xml,v 1.54 2009/02/15 09:09:49 jkois Exp $
    basiert auf: 1.74
-->

<press>
  <cvs:keywords xmlns:cvs="http://www.FreeBSD.org/XML/CVS" version="1.0">
    <cvs:keyword name="freebsd">
      $FreeBSD$
    </cvs:keyword>
  </cvs:keywords>

  <year>
    <name>2009</name>

    <month>
      <name>1</name>

      <story>
        <name>Coyote Point Builds on FreeBSD to Accelerate</name>
        <url>http://www.internetnews.com/infra/article.php/3795791</url>
        <site-name>Internet News</site-name>
        <site-url>http://www.internetnews.com/</site-url>
        <date>13. Januar 2009</date>
        <author>Sean Michael Kerner</author>
        <p>FreeBSD bildet die Basis f&#252;r Coyote Point's Software
          zur Beschleunigung von Webapplikationen.</p>
      </story>

      <story>
        <name>FreeBSD 7.1 Gets a Little Help from Sun</name>
        <url>http://www.internetnews.com/dev-news/article.php/3794561</url>
        <site-name>Internet News</site-name>
        <site-url>http://www.internetnews.com/</site-url>
        <date>06. Januar 2009</date>
        <author>Sean Michael Kerner</author>
        <p>Ein Artikel, der den Technologietransfer zwischen FreeBSD
	  und Sun n&#228;her beschreibt und zus&#228;tzlich neue
	  Funktionalit&#228;ten von FreeBSD 7.1 vorstellt.</p>
      </story>
    </month>
  </year>
</press>
